{
  "schemaVersion": 1,
  "category": "defense",
  "categoryName": "防御",
  "cards": [
    {
      "id": "defense_evade",
      "name": {
        "zhCN": "闪避",
        "en": "evade"
      },
      "category": "defense",
      "cost": {
        "resource": "action_point",
        "amount": 0
      },
      "special": false,
      "effects": [
        {
          "type": "nullify_attacks",
          "triggerCount": {
            "base": 1,
            "upgraded": 2
          }
        },
        {
          "type": "damage_reduction",
          "unit": "percent",
          "amount": {
            "base": 20,
            "upgraded": 40
          },
          "durationTurns": {
            "base": 1,
            "upgraded": 1
          }
        }
      ],
      "source": {
        "workbook": "Killkiss全套卡牌.xlsx",
        "sheet": "Sheet1",
        "row": 46,
        "rawLabel": "0 闪避evade"
      },
      "notes": []
    },
    {
      "id": "defense_block",
      "name": {
        "zhCN": "格挡",
        "en": "block"
      },
      "category": "defense",
      "cost": {
        "resource": "action_point",
        "amount": 0
      },
      "special": false,
      "effects": [
        {
          "type": "damage_reduction",
          "unit": "percent",
          "amount": {
            "base": 50,
            "upgraded": 100
          },
          "durationTurns": {
            "base": 1,
            "upgraded": 1
          }
        }
      ],
      "source": {
        "workbook": "Killkiss全套卡牌.xlsx",
        "sheet": "Sheet1",
        "row": 47,
        "rawLabel": "0 格挡block"
      },
      "notes": []
    },
    {
      "id": "defense_invisibility",
      "name": {
        "zhCN": "隐身",
        "en": "invisibility"
      },
      "category": "defense",
      "cost": {
        "resource": "action_point",
        "amount": 2
      },
      "special": true,
      "effects": [
        {
          "type": "skip_enemy_turns",
          "durationTurns": {
            "base": 1,
            "upgraded": 2
          }
        }
      ],
      "source": {
        "workbook": "Killkiss全套卡牌.xlsx",
        "sheet": "Sheet1",
        "row": 48,
        "rawLabel": "2 隐身invisbility（特殊）"
      },
      "notes": []
    },
    {
      "id": "defense_immunity",
      "name": {
        "zhCN": "免疫",
        "en": "immune"
      },
      "category": "defense",
      "cost": {
        "resource": "action_point",
        "amount": 2
      },
      "special": false,
      "effects": [
        {
          "type": "immunity",
          "triggerCount": {
            "base": 3,
            "upgraded": 5
          }
        }
      ],
      "source": {
        "workbook": "Killkiss全套卡牌.xlsx",
        "sheet": "Sheet1",
        "row": 49,
        "rawLabel": "2 免疫immune"
      },
      "notes": [
        "Excel 的 3（5）位于“攻击失效次数”列；依据卡名“免疫”，按免疫触发 3（5）次保存。"
      ]
    }
  ]
}
